title,url,score,price,category
Corruption erodes social trust more in democracies than in autocracies,https://www.frontiersin.org/journals/political-science/articles/10.3389/fpos.2026.1779810/full,483.0,,
MoD sources warn Palantir role at heart of government is threat to UK security,https://www.thenerve.news/p/palantir-technologies-uk-mod-sources-government-data-insights-security-state-secrets,389.0,,
My Journey to a reliable and enjoyable locally hosted voice assistant,https://community.home-assistant.io/t/my-journey-to-a-reliable-and-enjoyable-locally-hosted-voice-assistant/944860,147.0,,
Launch HN: Voygr (YC W26) – A better maps API for agents and AI apps,,15.0,,
I Love FreeBSD,https://it-notes.dragas.net/2026/03/16/why-i-love-freebsd/,163.0,,
Cert Authorities Check for DNSSEC from Today,https://www.grepular.com/Cert_Authorities_Check_for_DNSSEC_From_Today,24.0,,
"Kaizen (YC P25) Hiring Eng, GTM, Cos to Automate BPOs",https://www.kaizenautomation.com/careers,1.0,,
US Job Market Visualizer – Andrej Karpathy,https://karpathy.ai/jobs/,150.0,,
Launch HN: Chamber (YC W26) – An AI Teammate for GPU Infrastructure,https://www.usechamber.io/,2.0,,
Canada's bill C-22 mandates mass metadata surveillance,https://www.michaelgeist.ca/2026/03/a-tale-of-two-bills-lawful-access-returns-with-changes-to-warrantless-access-but-dangerous-backdoor-surveillance-risks-remains/,933.0,,
slamd - a dead simple 3D visualizer for Python,https://reddit.com/r/Python/comments/1rukp2j/slamd_a_dead_simple_3d_visualizer_for_python/,58.0,,
Comparing Python Type Checkers: Typing Spec Conformance,https://reddit.com/r/Python/comments/1rv80tj/comparing_python_type_checkers_typing_spec/,47.0,,
Pymetrica: a new quality analysis tool,https://reddit.com/r/Python/comments/1rupci4/pymetrica_a_new_quality_analysis_tool/,31.0,,
"Used FastF1, FastAPI, and LightGBM to build an F1 race strategy simulator",https://reddit.com/r/Python/comments/1ruxquu/used_fastf1_fastapi_and_lightgbm_to_build_an_f1/,8.0,,
Monday Daily Thread: Project ideas!,https://reddit.com/r/Python/comments/1ruu3rw/monday_daily_thread_project_ideas/,7.0,,
[Showcase] pytest-gremlins v1.5.0: Fast mutation testing as a pytest plugin.,https://reddit.com/r/Python/comments/1ruv4wx/showcase_pytestgremlins_v150_fast_mutation/,7.0,,
Library to integrate Logbook with Rich and Journald,https://reddit.com/r/Python/comments/1rv6q4l/library_to_integrate_logbook_with_rich_and/,4.0,,
nobody asked but I organized national FBI crime data into a searchable site (My first real website),https://reddit.com/r/Python/comments/1rve8k1/nobody_asked_but_i_organized_national_fbi_crime/,3.0,,
tethered - Runtime network egress control for Python in one function call,https://reddit.com/r/Python/comments/1rvdqdz/tethered_runtime_network_egress_control_for/,3.0,,
[Project] NetGlance - A macOS-inspired network monitor for the Windows Taskbar (PyQt6 + NumPy),https://reddit.com/r/Python/comments/1rvd76d/project_netglance_a_macosinspired_network_monitor/,3.0,,
ARC - Automatic Recovery Controller for PyTorch training failures,https://reddit.com/r/Python/comments/1rvct0q/arc_automatic_recovery_controller_for_pytorch/,3.0,,
"Showcase: kokage-ui — build FastAPI UIs in pure Python (no JS, no templates, no build step)",https://reddit.com/r/Python/comments/1rv7lcs/showcase_kokageui_build_fastapi_uis_in_pure/,2.0,,
"A quick review of `tyro`, a CLI library.",https://reddit.com/r/Python/comments/1rv7agv/a_quick_review_of_tyro_a_cli_library/,2.0,,
I built a minimal web-based MySQL/MariaDB GUI you can install with pip. Would love your feedback.,https://reddit.com/r/Python/comments/1rvf2hk/i_built_a_minimal_webbased_mysqlmariadb_gui_you/,2.0,,
Little game I'm working on: BSCP,https://reddit.com/r/Python/comments/1rv672u/little_game_im_working_on_bscp/,1.0,,
Scripting in API tools using Python (showcase),https://reddit.com/r/Python/comments/1rv5sl0/scripting_in_api_tools_using_python_showcase/,1.0,,
Asyncio Port Scanner in Python (CSV/JSON reports),https://reddit.com/r/Python/comments/1ruwl1a/asyncio_port_scanner_in_python_csvjson_reports/,1.0,,
I made a Python tool to detect performance regressions - Oracletrace,https://reddit.com/r/Python/comments/1rupjar/i_made_a_python_tool_to_detect_performance/,1.0,,
Unrooted tree for multidimentional projection of data in XY space,https://reddit.com/r/Python/comments/1rum88e/unrooted_tree_for_multidimentional_projection_of/,1.0,,
song-download-api-when-spotify-metadata is present,https://reddit.com/r/Python/comments/1rv5jnm/songdownloadapiwhenspotifymetadata_is_present/,0.0,,
"PackageFix — paste your requirements.txt, get a fixed manifest back. Live CVE scan via OSV + CISA KE",https://reddit.com/r/Python/comments/1rvb23k/packagefix_paste_your_requirementstxt_get_a_fixed/,0.0,,
roche-sandbox: context manager for running untrusted code in sandbox with secure defaults,https://reddit.com/r/Python/comments/1ruzt2x/rochesandbox_context_manager_for_running/,0.0,,
Intermediate in Python and want to build mobile applications,https://reddit.com/r/Python/comments/1ruu0zh/intermediate_in_python_and_want_to_build_mobile/,0.0,,
Update: We’re adding real-time collaborative coding to our open dev platform,https://reddit.com/r/Python/comments/1rv7ocn/update_were_adding_realtime_collaborative_coding/,0.0,,
I built a simple online compiler for my students to practice coding,https://reddit.com/r/Python/comments/1rv31yr/i_built_a_simple_online_compiler_for_my_students/,0.0,,
"Fjallraven - Foldsack No. 1 Backpack, Fits 15 Laptops",,,109.95,men's clothing
Mens Casual Premium Slim Fit T-Shirts ,,,22.3,men's clothing
Mens Cotton Jacket,,,55.99,men's clothing
Mens Casual Slim Fit,,,15.99,men's clothing
John Hardy Women's Legends Naga Gold & Silver Dragon Station Chain Bracelet,,,695.0,jewelery
Solid Gold Petite Micropave ,,,168.0,jewelery
White Gold Plated Princess,,,9.99,jewelery
Pierced Owl Rose Gold Plated Stainless Steel Double,,,10.99,jewelery
WD 2TB Elements Portable External Hard Drive - USB 3.0 ,,,64.0,electronics
SanDisk SSD PLUS 1TB Internal SSD - SATA III 6 Gb/s,,,109.0,electronics
Silicon Power 256GB SSD 3D NAND A55 SLC Cache Performance Boost SATA III 2.5,,,109.0,electronics
WD 4TB Gaming Drive Works with Playstation 4 Portable External Hard Drive,,,114.0,electronics
Acer SB220Q bi 21.5 inches Full HD (1920 x 1080) IPS Ultra-Thin,,,599.0,electronics
Samsung 49-Inch CHG90 144Hz Curved Gaming Monitor (LC49HG90DMNXZA) – Super Ultrawide Screen QLED ,,,999.99,electronics
BIYLACLESEN Women's 3-in-1 Snowboard Jacket Winter Coats,,,56.99,women's clothing
Lock and Love Women's Removable Hooded Faux Leather Moto Biker Jacket,,,29.95,women's clothing
Rain Jacket Women Windbreaker Striped Climbing Raincoats,,,39.99,women's clothing
MBJ Women's Solid Short Sleeve Boat Neck V ,,,9.85,women's clothing
Opna Women's Short Sleeve Moisture,,,7.95,women's clothing
DANVOUY Womens T Shirt Casual Cotton Short,,,12.99,women's clothing
